{
  "advisory": "この判定は非権威の提案であり、実装開始許可・merge 承認・merge の証明ではない",
  "epic_id": "EPIC-FDA-V1-5",
  "next_planned_pr_id": null,
  "reasons": [
    "Epic EPIC-FDA-V1-5 の全 planned PR が merged です。"
  ],
  "resume_commands": [
    "Epic EPIC-FDA-V1-5 は完了です。merge 承認は人間が実施済みです。"
  ],
  "schema_version": "fda.next_planned_pr_decision.v1",
  "verdict": "complete"
}
